{
 "schema": "xflare-bench-submission/1",
 "manifest": {
  "schema": "xflare-bench-manifest/1",
  "run_id": "00000000-0000-4000-8000-000000000004",
  "created_at": "2026-10-01T00:00:00Z",
  "client": {
   "revision": "7ca9adc5d0097a94e6ae5f2d12d8f4e197f77f9a",
   "branch": "main",
   "dirty": false,
   "dirty_digest": null
  },
  "build": {
   "artifact_id": "xflare-build-0001",
   "provenance_source": "artifact-manifest",
   "revision": "10c22cc915e7ba953b161ee06975c8efb3163e38",
   "dirty": false,
   "dirty_digest": null,
   "bundle": {
    "requested": "xflare-admin-2026.10.1",
    "resolved": "xflare-admin-2026.10.1",
    "kind": "admin"
   },
   "gluten": null
  },
  "run": {
   "argv": [
    "--reservation",
    "4242",
    "--xflare-toml",
    "scripts/config/Resource.mu.d1.toml.in",
    "--scale-factor",
    "100",
    "--engines",
    "velox,xflare",
    "--repeat",
    "3",
    "--executors",
    "4",
    "--executor-cores",
    "6",
    "--offheap",
    "64g",
    "--submission",
    "out.json",
    "--record-answers",
    "--application-per-engine",
    "1",
    "2",
    "3",
    "4",
    "5",
    "6",
    "7",
    "8",
    "9",
    "10",
    "11",
    "12",
    "13",
    "14",
    "15",
    "16",
    "17",
    "18",
    "19",
    "20",
    "21",
    "22"
   ],
   "scale_factor": "100",
   "codec": "snappy",
   "engines": [
    "velox",
    "xflare"
   ],
   "queries": [
    1,
    2,
    3,
    4,
    5,
    6,
    7,
    8,
    9,
    10,
    11,
    12,
    13,
    14,
    15,
    16,
    17,
    18,
    19,
    20,
    21,
    22
   ],
   "repeat_requested": 3,
   "record_answers": true,
   "answers": {
    "path": "scripts/spark/expected/sf_100.json.gz",
    "sha256": "caf37784a5077e430bcf1fdbdff4898188cf77608e01e308a9480907556b6895"
   },
   "resources": {
    "executors": 4,
    "executor_cores": 6,
    "offheap": "64g",
    "shuffle_partitions": null,
    "devices": null
   },
   "xflare_toml": {
    "name": "Resource.mu.d1.toml.in",
    "input_text": "[resource]\nexecutors = 4\ncores = 6\n",
    "input_sha256": "b7ba82977d39a754a277d9afc6ce7ff48a96a1d9ebc2b7c239c3a484b1bf8b47",
    "sent_sha256": "82f7b7bf36bf74a8e051e5cedaad77bdebd67440d45151f078028c9b2f9d6e17",
    "rendered_text": "[resource]\nexecutors = 4\ncores = 6\n[logging]\nlevel = \"info\"\n",
    "rendered_sha256": "82f7b7bf36bf74a8e051e5cedaad77bdebd67440d45151f078028c9b2f9d6e17"
   },
   "xflare_overrides": [
    {
     "key": "join.output_batch_rows",
     "value": "7680",
     "source": "default",
     "destination": "session"
    }
   ],
   "dataset": {
    "uri": "hdfs:///tpch/sf100",
    "marker": "tpch-sf100-v1"
   },
   "started_at": "2026-10-01T00:00:00Z",
   "finished_at": "2026-10-01T01:03:00Z",
   "exit_status": "ok",
   "application_mode": "per-engine"
  },
  "repeats": [
   {
    "index": 1,
    "invocation": "spark-submit --app tpch-100-r1-velox",
    "app_id": "app-dc2d5fb4",
    "artifact_id": "xflare-build-0001",
    "bundle": "xflare-admin-2026.10.1",
    "started_at": "2026-10-01T00:00:00Z",
    "finished_at": "2026-10-01T00:20:00Z",
    "status": "completed",
    "cleanup": "ok",
    "queries": [
     {
      "id": 1,
      "engines": {
       "velox": {
        "status": "ok",
        "elapsed_ms": 2591,
        "rows": 4,
        "verify": {
         "against": "previous",
         "status": "new",
         "detail": null
        },
        "error": null
       },
       "xflare": {
        "status": "ok",
        "elapsed_ms": 1037,
        "rows": 4,
        "verify": {
         "against": "previous",
         "status": "new",
         "detail": null
        },
        "error": null
       }
      },
      "evidence": {
       "status": "offloaded",
       "detail": null
      }
     },
     {
      "id": 2,
      "engines": {
       "velox": {
        "status": "ok",
        "elapsed_ms": 2682,
        "rows": 4,
        "verify": {
         "against": "previous",
         "status": "new",
         "detail": null
        },
        "error": null
       },
       "xflare": {
        "status": "ok",
        "elapsed_ms": 1074,
        "rows": 4,
        "verify": {
         "against": "previous",
         "status": "new",
         "detail": null
        },
        "error": null
       }
      },
      "evidence": {
       "status": "offloaded",
       "detail": null
      }
     },
     {
      "id": 3,
      "engines": {
       "velox": {
        "status": "ok",
        "elapsed_ms": 2773,
        "rows": 4,
        "verify": {
         "against": "previous",
         "status": "new",
         "detail": null
        },
        "error": null
       },
       "xflare": {
        "status": "ok",
        "elapsed_ms": 1111,
        "rows": 4,
        "verify": {
         "against": "previous",
         "status": "new",
         "detail": null
        },
        "error": null
       }
      },
      "evidence": {
       "status": "offloaded",
       "detail": null
      }
     },
     {
      "id": 4,
      "engines": {
       "velox": {
        "status": "ok",
        "elapsed_ms": 2864,
        "rows": 4,
        "verify": {
         "against": "previous",
         "status": "new",
         "detail": null
        },
        "error": null
       },
       "xflare": {
        "status": "ok",
        "elapsed_ms": 1148,
        "rows": 4,
        "verify": {
         "against": "previous",
         "status": "new",
         "detail": null
        },
        "error": null
       }
      },
      "evidence": {
       "status": "offloaded",
       "detail": null
      }
     },
     {
      "id": 5,
      "engines": {
       "velox": {
        "status": "ok",
        "elapsed_ms": 2955,
        "rows": 4,
        "verify": {
         "against": "previous",
         "status": "new",
         "detail": null
        },
        "error": null
       },
       "xflare": {
        "status": "ok",
        "elapsed_ms": 1185,
        "rows": 4,
        "verify": {
         "against": "previous",
         "status": "new",
         "detail": null
        },
        "error": null
       }
      },
      "evidence": {
       "status": "offloaded",
       "detail": null
      }
     },
     {
      "id": 6,
      "engines": {
       "velox": {
        "status": "ok",
        "elapsed_ms": 3046,
        "rows": 4,
        "verify": {
         "against": "previous",
         "status": "new",
         "detail": null
        },
        "error": null
       },
       "xflare": {
        "status": "ok",
        "elapsed_ms": 1222,
        "rows": 4,
        "verify": {
         "against": "previous",
         "status": "new",
         "detail": null
        },
        "error": null
       }
      },
      "evidence": {
       "status": "offloaded",
       "detail": null
      }
     },
     {
      "id": 7,
      "engines": {
       "velox": {
        "status": "ok",
        "elapsed_ms": 3137,
        "rows": 4,
        "verify": {
         "against": "previous",
         "status": "new",
         "detail": null
        },
        "error": null
       },
       "xflare": {
        "status": "ok",
        "elapsed_ms": 1259,
        "rows": 4,
        "verify": {
         "against": "previous",
         "status": "new",
         "detail": null
        },
        "error": null
       }
      },
      "evidence": {
       "status": "offloaded",
       "detail": null
      }
     },
     {
      "id": 8,
      "engines": {
       "velox": {
        "status": "ok",
        "elapsed_ms": 3228,
        "rows": 4,
        "verify": {
         "against": "previous",
         "status": "new",
         "detail": null
        },
        "error": null
       },
       "xflare": {
        "status": "ok",
        "elapsed_ms": 1296,
        "rows": 4,
        "verify": {
         "against": "previous",
         "status": "new",
         "detail": null
        },
        "error": null
       }
      },
      "evidence": {
       "status": "offloaded",
       "detail": null
      }
     },
     {
      "id": 9,
      "engines": {
       "velox": {
        "status": "ok",
        "elapsed_ms": 3319,
        "rows": 4,
        "verify": {
         "against": "previous",
         "status": "new",
         "detail": null
        },
        "error": null
       },
       "xflare": {
        "status": "ok",
        "elapsed_ms": 1333,
        "rows": 4,
        "verify": {
         "against": "previous",
         "status": "new",
         "detail": null
        },
        "error": null
       }
      },
      "evidence": {
       "status": "offloaded",
       "detail": null
      }
     },
     {
      "id": 10,
      "engines": {
       "velox": {
        "status": "ok",
        "elapsed_ms": 3410,
        "rows": 4,
        "verify": {
         "against": "previous",
         "status": "new",
         "detail": null
        },
        "error": null
       },
       "xflare": {
        "status": "ok",
        "elapsed_ms": 1370,
        "rows": 4,
        "verify": {
         "against": "previous",
         "status": "new",
         "detail": null
        },
        "error": null
       }
      },
      "evidence": {
       "status": "offloaded",
       "detail": null
      }
     },
     {
      "id": 11,
      "engines": {
       "velox": {
        "status": "ok",
        "elapsed_ms": 3501,
        "rows": 4,
        "verify": {
         "against": "previous",
         "status": "new",
         "detail": null
        },
        "error": null
       },
       "xflare": {
        "status": "ok",
        "elapsed_ms": 1407,
        "rows": 4,
        "verify": {
         "against": "previous",
         "status": "new",
         "detail": null
        },
        "error": null
       }
      },
      "evidence": {
       "status": "offloaded",
       "detail": null
      }
     },
     {
      "id": 12,
      "engines": {
       "velox": {
        "status": "ok",
        "elapsed_ms": 3592,
        "rows": 4,
        "verify": {